{
  "$schema": "https://json-schema.org/draft/2020-12/schema",
  "$id": "https://ledgerly.dev/contracts/categorize-request.schema.json",
  "title": "CategorizeRequest",
  "description": "The full request body of `POST /categorize` — plain JSON. `api` has already run the pgvector retrieval step (POST /embed-query + a nearest-neighbor search); this request carries the extracted expense fields, the org's category taxonomy, and the retrieved chunk texts for `ai` to classify against. `ai` never touches Postgres directly.",
  "type": "object",
  "additionalProperties": false,
  "required": ["document_id", "vendor", "currency", "total_minor", "categories"],
  "properties": {
    "document_id": {
      "type": "string",
      "format": "uuid"
    },
    "vendor": {
      "type": ["string", "null"]
    },
    "currency": {
      "type": "string"
    },
    "total_minor": {
      "description": "Money as an integer of minor units, same convention as the extraction contract.",
      "type": "integer"
    },
    "document_date": {
      "type": ["string", "null"],
      "format": "date"
    },
    "categories": {
      "description": "The organization's category taxonomy — the only names `ai` is allowed to choose from.",
      "type": "array",
      "minItems": 1,
      "items": {
        "type": "string",
        "minLength": 1
      }
    },
    "policy_chunks": {
      "description": "Top-k policy chunks retrieved by `api` via pgvector similarity against the expense's embedded description. May be empty if the organization has no policy documents, or no chunk cleared the similarity floor.",
      "type": "array",
      "items": {
        "type": "object",
        "additionalProperties": false,
        "required": ["chunk_text"],
        "properties": {
          "chunk_text": {
            "type": "string",
            "minLength": 1
          }
        }
      }
    },
    "correlation_id": {
      "type": ["string", "null"],
      "maxLength": 128
    }
  }
}
